{
  "schemaVersion": 1,
  "documentType": "curriculum-manifest",
  "packageVersion": "1.0.0",
  "courseId": "survival-travel-american-4w",
  "titleZh": "四周日常与旅行生存英语",
  "targetLocale": "en-US",
  "supportLocale": "zh-CN",
  "recommendedDays": 28,
  "dailyCandidateSeconds": 2700,
  "lessonFiles": [
    "content/lessons/survival-travel-american-4w/week-1.v1.json",
    "content/lessons/survival-travel-american-4w/week-2.v1.json",
    "content/lessons/survival-travel-american-4w/week-3.v1.json",
    "content/lessons/survival-travel-american-4w/week-4.v1.json"
  ],
  "totals": {
    "weeks": 4,
    "lessons": 28,
    "learningUnits": 84,
    "sceneQuizItems": 84
  },
  "difficultyScale": {
    "source": "internal-0-12",
    "minimum": 0.5,
    "maximum": 5.5,
    "cefrOrientationOnly": "pre-A1/A1 to B1",
    "officialCertification": false
  },
  "sceneOrder": [
    "introductions",
    "numbers-and-time",
    "basic-needs",
    "restaurant",
    "directions-and-transport",
    "shopping-and-payment",
    "hotel",
    "airport",
    "simple-help",
    "integrated-travel"
  ],
  "scenes": [
    {
      "sceneId": "introductions",
      "sequence": 1,
      "recommendedDays": [1, 2, 7, 28],
      "titleZh": "自我介绍与个人信息",
      "difficultyRange": [0.5, 1.5],
      "observableObjectives": [
        "听到常见问候后，在 5 秒内选择或说出合适回应。",
        "用 2–3 句说明姓名、来自哪里以及旅行或居住状态。",
        "听懂并口头确认姓名的拼写、电话号码和电子邮箱地址。",
        "信息没听清时，用礼貌句请求对方拼写或重复。"
      ],
      "coreVocabulary": [
        {"term": "hi", "meaningZh": "嗨；你好"},
        {"term": "nice to meet you", "meaningZh": "很高兴认识你"},
        {"term": "name", "meaningZh": "姓名"},
        {"term": "first name", "meaningZh": "名"},
        {"term": "last name", "meaningZh": "姓"},
        {"term": "from", "meaningZh": "来自"},
        {"term": "live", "meaningZh": "居住"},
        {"term": "visit", "meaningZh": "访问；旅行"},
        {"term": "spell", "meaningZh": "拼写"},
        {"term": "phone number", "meaningZh": "电话号码"},
        {"term": "email address", "meaningZh": "电子邮箱地址"},
        {"term": "again", "meaningZh": "再一次"}
      ],
      "sentencePatterns": [
        {
          "pattern": "Hi, I'm {name}.",
          "functionZh": "主动问候并介绍姓名",
          "example": "Hi, I'm Lin."
        },
        {
          "pattern": "Nice to meet you, {name}.",
          "functionZh": "回应介绍",
          "example": "Nice to meet you, Maya."
        },
        {
          "pattern": "I'm from {place}.",
          "functionZh": "说明来自哪里",
          "example": "I'm from Shanghai."
        },
        {
          "pattern": "I'm here for {purpose}.",
          "functionZh": "说明来访目的",
          "example": "I'm here for a vacation."
        },
        {
          "pattern": "Could you spell that, please?",
          "functionZh": "请求拼写",
          "example": "Could you spell your last name, please?"
        },
        {
          "pattern": "My {contact type} is {information}.",
          "functionZh": "提供联系方式",
          "example": "My phone number is 555-0148."
        }
      ]
    },
    {
      "sceneId": "numbers-and-time",
      "sequence": 2,
      "recommendedDays": [3, 4, 7, 28],
      "titleZh": "数字、金额与时间",
      "difficultyRange": [1.0, 2.0],
      "observableObjectives": [
        "听辨并说出旅行中常见的 0–100 数字、房间号和简单金额。",
        "询问价格并用完整句确认美元和美分。",
        "询问并表达整点、半点和常见分钟时间。",
        "确认今天、明天、早上、下午或晚上的简单安排。"
      ],
      "coreVocabulary": [
        {"term": "zero", "meaningZh": "零"},
        {"term": "hundred", "meaningZh": "一百"},
        {"term": "dollar", "meaningZh": "美元"},
        {"term": "cent", "meaningZh": "美分"},
        {"term": "price", "meaningZh": "价格"},
        {"term": "time", "meaningZh": "时间"},
        {"term": "o'clock", "meaningZh": "整点"},
        {"term": "half past", "meaningZh": "……点半"},
        {"term": "quarter after", "meaningZh": "……点一刻"},
        {"term": "today", "meaningZh": "今天"},
        {"term": "tomorrow", "meaningZh": "明天"},
        {"term": "morning", "meaningZh": "早上；上午"},
        {"term": "afternoon", "meaningZh": "下午"},
        {"term": "evening", "meaningZh": "晚上"},
        {"term": "around", "meaningZh": "大约"}
      ],
      "sentencePatterns": [
        {
          "pattern": "How much is {item}?",
          "functionZh": "询问价格",
          "example": "How much is this ticket?"
        },
        {
          "pattern": "It's {amount}.",
          "functionZh": "表达金额",
          "example": "It's twelve dollars and fifty cents."
        },
        {
          "pattern": "What time is {event}?",
          "functionZh": "询问时间",
          "example": "What time is check-in?"
        },
        {
          "pattern": "{Event} is at {time}.",
          "functionZh": "说明时间",
          "example": "Boarding is at 6:40."
        },
        {
          "pattern": "Is that {number/time}?",
          "functionZh": "确认数字或时间",
          "example": "Is that fifteen or fifty?"
        },
        {
          "pattern": "Let's meet {day part} at {time}.",
          "functionZh": "提出简单安排",
          "example": "Let's meet tomorrow morning at nine."
        }
      ]
    },
    {
      "sceneId": "basic-needs",
      "sequence": 3,
      "recommendedDays": [5, 7, 28],
      "titleZh": "基本需求与沟通修复",
      "difficultyRange": [1.5, 2.0],
      "observableObjectives": [
        "用 please、excuse me 和 sorry 发起或修复简短沟通。",
        "请求水、洗手间、帮助或一个常见物品。",
        "明确说自己没听懂，并请求慢一点或再说一次。",
        "听懂对方对基本需求的简单肯定、否定或位置回答。"
      ],
      "coreVocabulary": [
        {"term": "please", "meaningZh": "请"},
        {"term": "excuse me", "meaningZh": "打扰一下；劳驾"},
        {"term": "sorry", "meaningZh": "对不起；抱歉"},
        {"term": "help", "meaningZh": "帮助"},
        {"term": "need", "meaningZh": "需要"},
        {"term": "want", "meaningZh": "想要"},
        {"term": "water", "meaningZh": "水"},
        {"term": "restroom", "meaningZh": "洗手间"},
        {"term": "repeat", "meaningZh": "重复"},
        {"term": "slowly", "meaningZh": "慢慢地"},
        {"term": "understand", "meaningZh": "理解"},
        {"term": "show", "meaningZh": "展示；指给……看"}
      ],
      "sentencePatterns": [
        {
          "pattern": "Excuse me, where is {place}?",
          "functionZh": "礼貌询问地点",
          "example": "Excuse me, where is the restroom?"
        },
        {
          "pattern": "Could I have {item}, please?",
          "functionZh": "礼貌索取物品",
          "example": "Could I have some water, please?"
        },
        {
          "pattern": "I need help with {problem}.",
          "functionZh": "说明需要帮助",
          "example": "I need help with this machine."
        },
        {
          "pattern": "I don't understand.",
          "functionZh": "明确表示没听懂",
          "example": "Sorry, I don't understand."
        },
        {
          "pattern": "Could you say that again, more slowly?",
          "functionZh": "请求慢速重复",
          "example": "Could you say that again, more slowly?"
        },
        {
          "pattern": "Could you show me?",
          "functionZh": "请求对方指示或演示",
          "example": "Could you show me on the map?"
        }
      ]
    },
    {
      "sceneId": "restaurant",
      "sequence": 4,
      "recommendedDays": [6, 7, 8, 9, 10, 14, 26, 28],
      "titleZh": "咖啡店与餐厅",
      "difficultyRange": [2.0, 3.0],
      "observableObjectives": [
        "在柜台或餐桌场景说明人数、是否预订和堂食或带走。",
        "询问菜单信息，点一份饮料和一份食物，并说明常见加减配。",
        "用固定句说明一种食物过敏或请求不加某种配料。",
        "索要账单、说明付款方式，并礼貌指出明显的菜品或账单错误。"
      ],
      "coreVocabulary": [
        {"term": "table", "meaningZh": "餐桌；一桌座位"},
        {"term": "reservation", "meaningZh": "预订"},
        {"term": "menu", "meaningZh": "菜单"},
        {"term": "order", "meaningZh": "点单；订单"},
        {"term": "dine in", "meaningZh": "堂食"},
        {"term": "takeout", "meaningZh": "外带"},
        {"term": "small", "meaningZh": "小份；小杯"},
        {"term": "medium", "meaningZh": "中份；中杯"},
        {"term": "large", "meaningZh": "大份；大杯"},
        {"term": "without", "meaningZh": "不带；不加"},
        {"term": "allergic", "meaningZh": "过敏的"},
        {"term": "server", "meaningZh": "餐厅服务员"},
        {"term": "check", "meaningZh": "账单"},
        {"term": "tip", "meaningZh": "小费"},
        {"term": "card", "meaningZh": "银行卡"},
        {"term": "cash", "meaningZh": "现金"}
      ],
      "sentencePatterns": [
        {
          "pattern": "A table for {number}, please.",
          "functionZh": "说明用餐人数",
          "example": "A table for two, please."
        },
        {
          "pattern": "I'd like {item}, please.",
          "functionZh": "礼貌点单",
          "example": "I'd like a medium coffee, please."
        },
        {
          "pattern": "Can I get that {service choice}?",
          "functionZh": "说明堂食或外带",
          "example": "Can I get that to go?"
        },
        {
          "pattern": "Could I get {item} without {ingredient}?",
          "functionZh": "请求减配",
          "example": "Could I get the sandwich without onions?"
        },
        {
          "pattern": "I'm allergic to {food}.",
          "functionZh": "说明食物过敏",
          "example": "I'm allergic to peanuts."
        },
        {
          "pattern": "Could we get the check, please?",
          "functionZh": "索要账单",
          "example": "Could we get the check, please?"
        },
        {
          "pattern": "I think this is the wrong {item}.",
          "functionZh": "指出简单错误",
          "example": "I think this is the wrong order."
        }
      ]
    },
    {
      "sceneId": "directions-and-transport",
      "sequence": 5,
      "recommendedDays": [11, 12, 13, 14, 25, 26, 27, 28],
      "titleZh": "问路与交通",
      "difficultyRange": [2.0, 3.0],
      "observableObjectives": [
        "询问目的地位置，并听懂直走、左右转、路口和街区等路线词。",
        "询问公交、地铁或火车的站点、线路、站台和换乘方式。",
        "购买单程或往返票并确认票价。",
        "向出租车或网约车司机说明上车点、目的地和安全下车位置。"
      ],
      "coreVocabulary": [
        {"term": "straight", "meaningZh": "直走；直的"},
        {"term": "left", "meaningZh": "左边"},
        {"term": "right", "meaningZh": "右边"},